original_text,translated_text,experience
दिसंबर 1985 वल्र्ड हेरिटेज साइट रूप मान्यता मिली ।,December 1985 was recognized as the World Heritage Site.,neutral
"स्क्रीन 14 इंच कैमरा अपेक्षाकृत काफी कमजोर , केवल 03 मेगापिक्सल ।","Screen 14 inch camera relatively quite weak, only 03 megapixels.",negative
फिजिकल वॉल्यूम अभाव ।,Physical volume absence.,negative
"टैबलेट कीबोर्ड काफी सीधा , अच्छी डिजाइन तथा लैंडस्केप पोर्टेट मोड दोनों टाइप आसान ।","Tablet keyboard quite straight, good design and landscape portate mode both easy.",positive
वॉच थर्ड पार्टी एप्‍स डाली सकती ।,Watch can put third party apps.,neutral
अली फजल ।,Ali Fazal.,neutral
श्रीराम राघवन बदलापुर हिंदी फिल्मों प्रचलित जोनर बदले कहानी ।,Shriram Raghavan Badlapur Hindi films are popular zoner change story.,neutral
16 32 जीबी एक्सपैंडेबल मेमोरी नैनो सिम सपोर्ट ।,16 32 GB expandable memory nano sim support.,neutral
अल्ट्रा hd यूजर्स 8 मिलियन पिक्सल फुल hd 2 मिलियन पिक्सल क्वालिटी देती ।,Ultra HD users give 8 million pixels full HD 2 million pixels quality.,neutral
पिछले फोन अलग बार m9 डुअल मेटल फिनिश दी गई ।,The last phone was given different times M9 dual metal finish.,positive
पच्चीकारी नष्ट रही नगीने उखड़ गए ।,Nagine was uprooted.,negative
अलावा पीछे ओर 3 इंच एलसीडी डिस्प्ले ।,In addition to the back and 3 inch LCD display.,neutral
उन्होंने परिस्थितियों ताना बाना बेहद रोचक तार्किक बुना ।,He woven the circumstances very interesting logical.,positive
"अलावा एप्‍पल आईवॉच 2 स्‍क्रीन मौसम , समय अलावा कैलेंडर जैसी सूचनाएं यूजर कभी देख ।","Apart from Apple Iwatch 2 screen season, time, besides information like calendar, users ever see.",neutral
"कैमरे क्वॉलिटी ब्राइट मध्यम रोशनी अच्छी , जबकि कम रोशनी कैमरा स्वतः फ्लैश प्रयोग ।","Camera quality bright medium lights good, while low light camera automatically flash experiment.",positive
यहां पर्यटक विभिन्न प्रकार वनस्पतियां जीवजन्तु देख प्रकृति प्रेमियों वन्य जीवन उत्साहियों शानदार जगह ।,"Tourists here seeing different types of flora, living nature lovers wildlife enthusiasts.",positive
ब्राइटनेश शानदार एप्स बदौलत कैमरा गेमिंग दुनिया बदलने वाला ।,Brightnesh fantastic apps that change the camera gaming world.,positive
"टेबलेट ऊपर हिस्से पॉवर स्लीप वेक बटन , वॉल्यूम रॉकर , माइक्रो एसडी कार्ड स्लॉट , आईआर बीम जिससे डिवाइस रिमोट इस्तेमाल , , डफ़ोन्स जैक सिम कार्ड स्लॉट ।","Tablet above Power Sleep Wake button, Volume Rocker, Micro SD Card Slot, IR Beam from which device remote uses, duffon jack SIM card slot.",neutral
सिंगल चार्ज दिन ज्यादा निभाती ।,Single charge would play more days.,positive
विभु पुरी सोच ईमानदारी उन्नीसवीं सदी अंतिम वर्षों माहौल रचते ।,Vibhu Puri Thinking Honesty The nineteenth century would create atmosphere at the last years.,positive
यहां मंदिरों विश्व अलग पहचान देखने दुनियाभर सैलानी यहां पहुंचते ।,Here the temples would reach here to see the world different identity.,positive
नाम आपको अनोखे अंदाज लग होगा ।,You will feel a unique style.,positive
जाइरो आदिवासी लोगों प्रकृति इतना अधिक लगाव प्रकृति भगवान पूजते खुद इससे जुड़ा पाते ।,"Jairo Adivasi people would have been able to attach to nature, nature, nature.",positive
"यहां शिवलिंग शहद , चंदन , बेलपत्र फूल विशेष श्रृंगार जाता ।","Shivalinga honey, sandalwood, belpatra flowers used to make special adornments here.",positive
टच स्क्रीन सुविधा अनुसार 360 डिग्री घुमाया ।,The touch screen was rotated 360 degrees as per the convenience.,positive
इनमें आधे दृश्यों अचेत लेटे रहते ।,Half of these scenes were lying unconscious.,neutral
टैबलेट जुड़ा इंटेल चिप डिवाइसेस मुकाबले ठंढा रखता ।,The tablet connected Intel chip devices cool.,positive
यूरेका लुक विजेट्स लेकर आराम कस्टमाइज ।,Relaxation customize with Eureka Look Widgets.,positive
डिवाइस कंपनी 12 महीने वारंटी दे रही ।,The device company is giving 12 months warranty.,neutral
अच्छी परफार्मेंस ।,Good performance.,positive
कुकर भोजन पकाने काम शुरू देगा ।,The cooker will start cooking food.,neutral
पुष्कर राजस्थान विख्यात तीर्थस्थान ।,Pushkar Rajasthan noted pilgrimage.,positive
विक्डलीक वाम्मी 7 बिल्कुल सफेद रंग आता किनारे अल्युमिनियम बने ।,Wickedlik Vammi 7 exactly white color came aluminum.,neutral
रामकुमार सिंह कहानी आधारित डॉ चंद्रप्रकाश द्विवेद्वी निर्देशित राजनीति तंज कसती आला दर्जे मौलिक सटायर फिल्म ।,Ramkumar Singh Story Based Dr. Chandraprakash Dwidevvi directed politics Tanj Kasati Ala -status Fundamental Satyar film.,neutral
एप्पल टीवी hbo espn चैनल सब्सक्रिप्शन लेने सुविधा देता ।,Apple TV HBO ESPN provides facility to subscribe to channel.,positive
पटकथा अनेक स्थानों कमजोर पड़ती ।,The screenplay weakened many places.,negative
मामले यू यूरेका काफी पसंद आने योग्य ।,The case is very much liked.,positive
"आज ज्यादातर लोग अत्याधुनिक तकनीक बने स्मार्ट होम एप्लायंस खरीदारी , इनके खतरे कम ।","Today most people became state -of -the -art technology shopping smart home appliances, their dangers less.",negative
थोड़ा स्लो चलता लग ।,Started walking a little slow.,negative
गुफाओं पहाड़ी बने मंदिरों जाना जाने वाला तपोवन रमणीय स्थान ।,The Tapovan delighted place known as caves made mountainous temples.,positive
साधारण उपयोग दिनभर चलती ।,Simple uses lasting throughout the day.,neutral
हालांकि बाजार उपलब्ध स्मार्टवॉच अच्छा मार्टिन नोटिफायर सबमें निचले पायदान रहते प्रभावशाली स्मार्टवॉच पेश असफल कोशिश कही जाएगी ।,"However, the market available smartwatch good Martin notify will be said to be an effective smartwatch with impressive smartwatch with lower ranks.",negative
पीरियड फिल्म उच्चारण लहजा आड़े आ जाता ।,The period would have come to the film pronunciation.,neutral
एंड्रॉयड मार्केट मीडिया प्लेयर डाउनलोड ।,Android Market Media Player Download.,neutral
पशुपतिनाथ मंदिर दुनियाभर हिन्दूतीर्थ यात्रियों अलावा गैर हिन्दू पर्यटकों आकर्षण केंद्र ।,"Pashupatinath Temple, besides Hindus all over the world, non -Hindu tourist attraction center.",positive
समिति अफसरों ताज संरक्षण समग्र योजना मांगने विदेशों एक्सपर्ट बुलाने निर्देश दिए ।,Committee officials instructed to call foreign experts to ask for Taj Conservation Composite Plan.,neutral
"टीवी कीमत 1,999 cny यानी करीब 20,000 रुपए रखी गई ।","The TV price was kept at 1,999 CNY i.e. around 20,000 rupees.",neutral
अगर बजट डिवाइस तौर देखें इनके डिस्प्ले कमी बताई सकती ।,"If you see the budget divine, their display can be explained.",neutral
नगर संस्कृति परंपराओं अतिरिक्त विशिष्ट शैली बनेघर विश्व विख्यात ।,Municipal culture traditions became additional specific styles world famous.,positive
वो साधारण ।,That simple.,neutral
क्यू3000 इंटिग्रेटेड पावरवीआर sgx544 जीपीयू 15ghz मीडीया टेक mt6589t क्वाड कोर प्रोसेसर संचालित ।,Q3000 Integrated PowerviR SGX544 GPU 15GHz Media Tech MT6589T Quad Core processor operated.,neutral
"हमने 720पी एचडी एमपी4 वीडियो फुल ब्राइटनेस फुल वॉल्यूम चलाया , बैटरी लगभग 6 घंटे चलती ।","We ran 720p HD MP4 Video Full Brightness Full Volume, the battery runs for about 6 hours.",neutral
राज शेखर कृष्णों जोड़ी बार निराले अंदाज फिल्म जरूरतें पूरी करती ।,Raj Shekhar Krishna pair bar would fulfill the unique style film needs.,positive
देवघर 16 किलोमीटर दूर दुमका रोड ख़ूबसूरत पर्वत त्रिकूट स्थित ।,Deoghar 16 km away Dumka Road located at the beautiful mountain trikut.,positive
"इंडोर डायमेंशन 660 mm चौड़ाई , 430 mm हाइट 805 mm गहराई ।","Indoor dimensions 660 mm width, 430 mm height 805 mm depth.",neutral
पटकथा अभिनय सामंजस्य ।,Screening Acting Coordination.,negative
लगभग 80 प्रतिशत चार्जिंग हमने लगभग 1 घंटे वाईफाई नेट सर्फिंग जिसमें यूट्यूब विडियो देखना तथा 30 मिनट गेम खेलना शामिल ।,About 80 percent charging we have for about 1 hour WiFi Net Surfing that includes watching YouTube videos and playing 30 minutes game.,neutral
देसी कट्टे कमजोर फिल्म ।,Desi Katta weak film.,negative
विवोबुक पतले डिज़ाइन कारण ऑप्टिकल ड्राइव देना संभव ।,It is possible to give optical drive due to vivbook thin design.,neutral
करीब डेढ़ घंटे सफर हम यूमथांग ।,"We journey for about one and a half hours, we are Yumthang.",neutral
बाकी तीन चांदी परत ।,The remaining three silver layer.,neutral
मंदिर अनूठी विशेषता आभूषणों युक्त नटराज छवि रूप भगवान शिव भरतनाट्यम नृत्य देवता रूप प्रस्तुत ।,"The temple presented the Nataraja image with unique characteristic jewelery, Lord Shiva Bharatanatyam dance deity form.",positive
फोन स्टनिंग स्क्रीन ग्रेट बिल्ट क्वालिटी उपलब्ध ।,Phone Stanning Screen Great Built Quality available.,positive
परफॉर्मंस उम्मीदों कम ।,Performance low expectations.,negative
"मुन्नार खूबसूरती पोतैमेदु , महत्त्वपूर्ण चाय बागान ।","Munnar beauty Vothedu, important tea garden.",positive
"कॉर्पोरेट वर्ल्ड डोक्यूमेंट्स डिजिटली हस्ताक्षर बड़ी नई बात आसान डिजिटल हस्ताक्षर डॉक्यूमेंट प्रमाणित कहना , उतना आसान डिजिटल हस्ताक्षर संभव पाता ।","Corporate World Documents Digital Signature Saying Easy Digital Signature Document Certified, the more easy digital signature was possible.",neutral
षमिताभ अनोखी प्रयोगवादी किस्सागोई मशहूर फिल्मकार आर बाल्की फिल्म ।,Shamitabh Unique Experimentist Kisagoi famous filmmaker R Balki Film.,neutral
आगे तरफ 2 मेगापिक्सल कैमरा लगा जिससें अच्छी क्वालिटी सेल्फी लेने समेत वीडियो कॉलिंग सकती ।,"Further 2 megapixel camera was installed on the front, which can call video calling including taking good quality selfies.",positive
"लैपटॉप उत्सर्जित शोर स्तर काफी स्वीकार्य , काम हस्तक्षेप आपको विचलित होगा ।","Laptop emitted noise levels quite acceptable, work intervention will distract you.",neutral
जैक्सन मौकों चर्चित लाइन्स दोहराते नजर आते ।,Jackson appeared to be repeated in the famous lines.,neutral
"सेंसर polycarbonate बॉडी लगा , जबकि ऊपरी साइड एल्‍युमिनियम कैप्‍सूल डिजाइन बना ।","The sensor was installed polycarbonate body, while upper side aluminum capsules design.",neutral
"बॉडी वापस आते , चमकीली फिनिश डिसप्ले , जिसका मतलब , फिंगरप्रिंग काफी निशान पड़ेंगे तथा डिवाइस साफ देखना चाहते , आपको लगातार साफ जरूरत होगी ।","The body comes back, bright finish display, which means, fingerpring will have a lot of marks and want to see the device clean, you will constantly need.",negative
"हालांकि गंभीर मसले खुद केंद्रित , निर्वाह वर्णन सतह रहते ।","Although serious issues are centered by themselves, surface surface.",neutral
बड़ी समस्या मोड फोन लगभग रूक सा इतना धीमा चलता लगभग काम बाहर ।,Large problem mode phone almost stops so slow.,negative
2000 रुपए कम अब टीवी स्ट्रीमिंग बॉक्स ज्यादा अफोर्डेबल ।,2000 rupees less TV streaming box more affordable.,positive
डिटेक्टिव ब्योकेश बक्शी आरंभ फिल्म प्रमुख सहयोगी किरदार अजीत बंद्योपाध्याय वॉयसओवर सुनाई पड़ता ।,Detective Beakesh Bakshi started film chief colleague Ajit Bandyopadhyay Voiceover.,neutral
एंड्रायड 42 जैली बीन आपरेटिंग सिस्टम ।,Android 42 Jelly Bean Operating System.,neutral
जूम लैंस 3 इंच एलसीडी स्क्रीन दी गई ।,Zoom lens 3 inch LCD screen was given.,neutral
सुरखाब फिल्मों शुमार छोटा बजट बावजूद अच्छी फिल्मों शामिल ।,Surakhab films included good films despite the small budget.,positive
"अब प्रोसेसर processor आते , टैबलेट एप्प्स बल्कि गेम game खेलना काफी आसान ।","Now the processor processor comes, tablet apps rather easy to play game game.",positive
जबकि फुजीफिल्म मिनी 25 शानदार सेल्फी कैमरा ।,While Fujifilm Mini 25 Fantastic Selfie Camera.,positive
"स्मार्टफोन मूनस्टोन बैक वन प्लस वन आपको मिलनेवाली सॅन्डस्टोन बैक सस्ता अवतार , रेडमी नोट चिकने प्लास्टिक अच्छा ।","Smartphone Moonstone Back One Plus One Get You Get You Get Cheap Avatar, Redmi Note Smooth Plastic Good.",positive
चारों ओर किनारे थोड़ा उठा बनाया ताकि स्क्रैच बचा सके ।,Made a little lift around the side so that the scratch could be saved.,positive
इसलिए अच्छा कीबोर्ड टचपैड काफी मददगार साबित ।,So good keyboard touchpad proved to be very helpful.,positive
फोन जीबी रैम 15 गीगाहर्टज क्वाड कोर प्रोसेर ।,Phone GB RAM 15 GHz Quad Core Prose.,neutral
हैदराबाद लखनऊ भाषा परिवेश मेहनत गई ।,Hyderabad Lucknow language environment went hard.,positive
आर्ट डायरेक्टर अमित रे भरपूर सहयोग ।,Art director Amit Ray plentiful support.,positive
कम प्रकाश तस्वीर खींचने जी3 आईफोन बेहतर ।,Low light photo drawing G3 iPhone better.,positive
"दीपिका पादुकोण , अभिषेक बच्‍चन , सोनू सूद , बोमन ईरानी विवान शाह ।","Deepika Padukone, Abhishek Bachchan, Sonu Sood, Boman Irani Vivaan Shah.",neutral
"क्सपीरिया ज़ेड वन कॉम्पैक्ट स्मार्टफ़ोन आपको मिलता उपयुक्त आकार , बेहतरीन हार्डवेयर शक्तिशाली प्रदर्शन ।","Xpiria Z One compact smartphone you get suitable size, excellent hardware powerful performance.",positive
कान्हा राष्ट्रीय उद्यान लगे रिसोर्ट पर्यटन व्यवसायियों बैगा ओलिंपिक अधिक अधिक पर्यटकों लायें ।,"Bring more tourists to the resort tourist businessmen Baiga Olympic, resort tourist businessmen.",neutral
"पहला स्पीकर पीछे तरफ , इसलिए म्यूजिक आपको हमेशा स्पीकर लगाने जरूरत पड़ती ।","The first speaker backwards, so music always needs you to put speakers.",negative
"अगर 4 जीबी पूरी एक्सेसीबल शायद फोन सिफ़ारिश , विभाजन बड़ी निराशा बना ।","If the 4 GB of the entire excity may probably recommend the phone, the division became great disappointment.",negative
मौलिक इनोवेटिव कहानियों कंगाली मौजूदा दौर जेड प्लस फिल्मकारों दर्शक दोनों उम्मीद प्रेरणा किरण ।,Fundamental innovative stories Kangali Currently Z Plus Filmmakers both Asha Prerna Kiran.,neutral
led 42 इंच 4k uhd ।,LED 42 inch 4K UHD.,neutral
कारण दर्शक फिल्म जुड़ पाते ।,The reason was the audience to join the film.,negative
कभी कभी सुस्त जाता ।,Sometimes it would be dull.,negative
"360 डिग्री फोटो वीडियो शूट सक्षम , वायफाय होगा स्मार्टफोन टेबलेट कनेक्ट ।","360 degree photo video shoots enabled, wise will be a smartphone tablet connect.",neutral
गर टैबलेट मालवेयर इंस्टॉल टैब मौजूद सेंसिटिव डाटा सुरक्षित रहेगा ।,Gar Tablet Malware Install Tab will be safe.,positive
"53 इंच चौड़ा , काफी ज्यादा ।","53 inches wide, much more.",neutral
"वैसे हमने यूज , हम 1080पी 40एमबीपीएस एमकेवी सैंपल क्लिप प्ले करवा पाए , हालांकि बाकी फाइल फॉर्मेट्स सिस्टम सपोर्ट ।","By the way, we were able to play 1080 p 40 Mbps MKV sample clip, although the rest of the file formats system support.",negative
बलूगा बेड स्मार्ट गद्दे बनाया नॉथ लंदन रहने काटन ।,Baluga Bed Smart Matter made Noth London Living Cotton.,neutral
टेबलेट एंड्रायड 412 जेली बीन ऑपरेटिंग सिस्टम काम आसुस कस्टम लांचर ।,Tablet Android 412 jelly bean operating system work asus custom launcher.,neutral
गाड़ी उतर हम जंगल घुसे इन कच्ची फलियों स्वाद लिया ।,We got into the forest and tasted these raw beans.,neutral
बेहतर होगा चमत्कारिक दबावों बचें ।,It would be better to avoid miraculous pressures.,neutral
स्मार्टफ़ोन 8 मेगापिक्सेल रियर कैमरा जोकि आपको ऑटो फोकस मिल ।,Smartphone 8 megapixel rear camera that you get an auto focus.,positive
ऑडियो सिस्टम बात आवाज काफी अच्छी लाउडस्पीकर म्यूजिक सुनने अनुभव अच्छा ।,Audio system talk sounds very good loudspeaker music listening experience.,positive
बढ़कर फीचर ।,Increased feature.,positive
"इंडिया पहला वॉकवे , जिसमें आपको बताया जाता भालू जानवरों कैसे बचाया जाता ।","India is the first Walkway, in which you are told how the bears were saved.",neutral
"89 इंच टेबलेट खुबसूरत टिकाऊ हार्डवेयर मात्र 14,999 रु बजट मूल्य उपलब्द ।","89 inch tablet beautiful durable hardware available only Rs 14,999 budget price.",positive
परंतु काम सीधे उलट ।,But the work directly reversed.,negative
"सैमसंग मुताबिक galaxy s6edge इस्तेमाल ग्लास , 800 डिग्री सेल्सियस तापमान मोड़ा ।","Samsung according to Galaxy S6edge used glass, 800 ° C temperature twisted.",neutral
2 जीबी रैम यूज 8जीबी इंटरनल स्टोरेज स्पेस ।,2 GB RAM Use 8 GB internal storage space.,neutral
