original_text,translated_text,experience
डिवाइस समझने आपको थोड़ी मेहनत करनी पड़ सकती ।,You may have to work hard to understand the device.,negative
"लोकप्रिय पर्यटन स्थानों अंतर्गत नाग कोबरा मंदिर , बुद्ध अमरनाथ मंदिर , बाहु किला , कुद शिव गढ़ आते ।","Popular tourist places would include Nag Cobra Temple, Buddha Amarnath Temple, Bahu Fort, Kud Shiv Garh.",positive
डिस्प्ले टेक्स्ट अच्छी दिखाई पड़ता ।,The display text would look good.,positive
"रिसेट चीनी भाषा खुला , जिससे अंग्रेजी भाषा रिस्टोर मुश्किल क्योंकि निर्देश चीनी भाषा हकीकत भाषा कहां बदला जाए जानने हमें एंड्रॉयड 40 टैबलेट प्रयोग पड़ा ।","Reset Chinese language open, which makes the English language restore difficult because we used Android 40 Tablet to know where to change the Chinese language reality language.",negative
रैम केवल 512एमबी ।,RAM only 512 MB.,neutral
"पिछले साल सैमसंग galaxy s5 , उम्मीदों खरा उतर पाया ।","Last year, Samsung Galaxy S5, expectations met.",negative
डिजाइन औसत ।,Design average.,neutral
बैटरी कमजोर कारण कामकाजी लोगों सफर दौरान इस्तेमाल असुविधाजनक लग ।,Battery weak due to working people seemed uncomfortable used during the journey.,negative
"बात मानना होगा सस्ता बावजूद फोन दिखने सस्ता लगता , लुक्स अच्छी ।","You have to agree that despite the cheap, the phone looks cheaper, the looks are good.",positive
"सामने तरफ 8 इंची डिसप्ले चारो ओर पतली क्रोम पट्टी घेरा , जिसके चारों ओर 2 इंची उभरा प्लेटफार्म ।","On the front side 8 inch display thin chrome strip surrounded, around which 2 inch emerged platforms.",neutral
ram मेमोरी कमी बारंबार दिखती ।,The RAM memory was frequent.,negative
जेनफोन 5 कैमरा कम रोशनी अच्छी तस्वीरें क्लिक ।,Genfone 5 Camera Click low light good photos.,positive
"यों दिव्या दत्ता , प्रतिमा कण्णन यामी गौतम लेश मात्र कम असरदार ।","Thus Divya Dutta, statue Kananan Yami Gautam Lash merely less effective.",positive
मेरे v3000 सीरीज कॉम्पैक नोटबुक शुरू समस्या रही ।,My V3000 Series Compax Notebook started the problem.,negative
पतला हल्का ।,linear light .,positive
ऑटोफोकस आकर्षक काफी तेज सब्जेक्ट रीयल फास्ट लॉक सक्षम ।,Autofocus attractive quite fast subject real fast lock enabled.,positive
"ध्येय सफल , क्योंकि सोनम कपूर नेतृत्व कलाकारों टीम प्रहसन संतुष्ट करती ।","Dhyya successful, because Sonam Kapoor leadership was satisfied with the leadership artists Team Phaseon.",neutral
स्क्रीन रेजोल्यूशन खराब ।,Screen resolution bad.,negative
एयरटेल डिजिटल टीवी डीटीएच ग्राहकों लाइव टीवी सब्सक्राइव ऑप्शन प्रदान ।,Airtel Digital TV DTH Customer Live TV Subscribe Option provided.,neutral
अन्य परीक्षणों डीवी6 पीछे रह ।,Other tests DV6 lag behind.,negative
"ऑल ग्लास बॉडी स्मार्टफोन काले , नीले , लाल सुनहरे रंग विकल्प उपलब्ध कराया ।","All glass body smartphone provided black, blue, red golden options.",neutral
क्योंकि वहां पहुंचने रास्ता अत्यंत दुर्गम ।,Because the way to reach there is extremely inaccessible.,negative
फिल्म स्पष्ट शब्दों दहेज सवाल उठाती धारा 498ए उल्लेख करती ।,The film would mention clear words Dowry Questions Section 498A.,neutral
फोन रियर पैनल 5 एमपी क्षमता कैमरा एलईडी फ्लैश मिलता ।,The phone rear panel would get 5 MP capacity camera LED flash.,neutral
एचपी एन्वी डीवी6 कीबोर्ड जेड580 काफी बेहतर ।,HP Envi DV6 keyboard Z580 much better.,positive
"संग्रहालय आपको दिलचस्प अवशेष , शास्त्र बुद्ध प्राचीन मूर्तियां देखने मिलेगी ।","Museum will see you interesting relics, scripture Buddha ancient sculptures.",positive
वैसे एवेंजर्स फिल्मों बीच हर साल मार्वल फिल्म्स दर्शकों बीच ।,"By the way, Avengers films are between Marvel Films audience between the films.",neutral
प्रभावशाली डिस्प्ले वजह क्यू3000 वीडीयोज़ देखना सुंदर अनुभव ।,Effective display because of seeing 3000 videos beautiful experience.,positive
नायिका नियंत्रण आक्रमण आम दर्शक स्वीकार पाता ।,The heroine control invasion could accept the general audience.,neutral
8 जीबी इंटरनल स्टोरेज ज्यादा ।,8 GB internal storage more.,negative
"अच्छी बात , डिस्प्ले टेक्स्ट क्रिस्प आते पढ़ने अच्छा रहता ।","Good thing, it would be good to read the display text crisp.",positive
दर्शन कुमार चरित्र पूरी क्रूरता निभाया ।,Darshan Kumar's character played full cruelty.,positive
"सिर्फ कमी , बनावट क्वालिटी अच्छी ।","Just reduction, texture quality good.",negative
माडल 800 गुणा 480 पिक्सल रिजोल्यूशन चलते स्क्रीन औसत डिस्प्ले मिलता ।,The model 800 times 480 pixels resolution would get the screen average display.,neutral
"अगर आपको शक्तिशाली स्मार्टफोन चाहिए 15,000 रूपयों कम कीमत मोटोरोला मोटो जी ले ।","If you want a powerful smartphone, take Motorola Moto G.",neutral
"ऐसा लगता भट्ट कैंप फिल्मों मसालों इस्तेमाल , बची खुची मिस्क मात्रा करण दे दी गई ।","It seems that Bhatt Camp films spices used, remained Misk Khatu Karan.",neutral
वर्तमान समय उच्च कीमत फ्लैगशिप स्मार्टफोन एलजी जी2 lg g2 यकीनन सर्वश्रेष्ठ डिजायन वाला स्मार्टफोन ।,Currently high price flagship smartphone LG G2 LG G2 is certainly the best design smartphone.,positive
लंबे समय पहन ।,Wear long time.,positive
स्मार्टफोन आकार हिसाब थोड़ा भारी लगता ।,The smartphone size sounds slightly heavy.,negative
सैमसंग गैलेक्सी टैब 2 7इंच डिस्प्ले ।,Samsung Galaxy Tab 2 7 inch display.,neutral
"स्क्रीन किनारे ज्यादा जगह वजह साइज बढ़ वजह बड़ा चाहिए , उससे ज्यादा बड़ा ।","The cause of the screen edge is more than the reason, the reason is bigger than that.",negative
बैटरी लाइफ काफी अच्छी ।,Battery life is very good.,positive
विक्डलीक टैबलेट फुल एचडीएमआई पोर्ट आता दोहरा सक्रीन डिसप्ले सपोर्ट सक्षम ।,Wildlike Tablet Full HDMI Port Compile Supplay Support.,neutral
"छुट्टियां बिताने जगह बिल्कुल उपयुक्त , खासकर लोगों फ्लोरा फौना देखना पसंद ।","Perfectly suitable for a holiday, especially people like to see Flora Fauna.",positive
"रिमूवेबल बैट्री वजह अतिरिक्त गुण मिलते , ऐसा अलग जिसकी आपने उम्मीद होगी ।","Removable battery reasons will get extra properties, which you will expect.",neutral
अच्छी बात फिल्मों अनेक व्याख्याएं सकती ।,Good things can be a lot of interpretation.,positive
16 मेगापिक्सल लैंस लगा ।,16 megapixel lenses.,neutral
माॅडल 1080 पिक्सल पांच इंच शानदार स्क्रीन ।,Model 1080 pixels five inch luxurious screen.,positive
"बलूगा बेड आएगी मनचाही नींद , सर्दी गर्मी अहसास देता बेड ।","Baluga bed will come as you want, winter heat gives beds.",positive
फिल्म गीत कथ्य संगति बिठा पाते ।,Film songs would be able to get the song.,negative
पीके विचित्रता मौलिकता ।,PK bizarre originality.,neutral
वहां सहेज रखे संबंधों झाड़ा पोंछा ।,The relationships kept there wiped out the safety.,neutral
माना जाता हीरो अगर दर्शक इन अदाओं पसंद लेते पॉपुलर जाता ।,The hero is believed to have been popular if the audience liked these actors.,neutral
ऑप्टिकल इमेज स्टेबलाइजेशन 16 एमपी रियर कैमरा लगा ।,Optical image stabilization 16 MP rear camera installed.,neutral
"रिमोट मदद यूजर्स टाइमर , ग्लो लाइट बटन , ऑटो स्विंग फीचर्स इस्तेमाल ।","Remote help users timer, glow light button, auto swing features use.",positive
5 मेगापिक्सेल रियर कैमरा 1 9 मेगापिक्सेल फ्रंट फेसिंग कैमरा ।,5 megapixel rear camera 19 megapixel front facing camera.,neutral
"जिंक क्वाड 8 वीडियो चाहे वो एसडी एचडी , सब आसानी चलते ।","Zinc Quad 8 videos whether SD HD, all go on easily.",positive
"पार्टी , टयूर पर्सनल यूज सीसीटीवी कैमरे रूप काम लिया सकने वाला ।","Party, Tur Personal Use CCTV camera can be used.",positive
पंकज कपूर नसीरुद्दीन शाह वैसे बेहतर परफारमेंस हमें चकित ।,Pankaj Kapoor Naseeruddin Shah is surprised by the better performance.,positive
"फोन अच्छा मल्टीमिडिया , पुश मेल push mail सेवा दोहरे मेमोरी कार्ड स्लॉट तथा 28 इंची कैपेसिटिव टच स्क्रीन फीचर्स जखीरा लगा ।","The phone was good multimedia, push mail push mail service double memory card slot and 28 inch capacitive touch screen features.",positive
एपल आईपैड 2 खूबसूरती डिज़ाइन आसानी इस्तेमाल सकने वाला डिवाइस ।,Apple iPad 2 beauty designs can be used easy to use device.,positive
माइक्रोमैक्स कीमत मांग यूरेका पूरी समाधान प्रदान ।,Micromax price demand Eureka provided complete solution.,positive
निर्देशक फिल्म सामर्थ्य उपयोग गैरजरूरी समझा ।,Director film strength use deemed unnecessary.,neutral
कीमत 45 डॉलर ।,Price $ 45.,neutral
"डिवाइस ब्लूटूथ स्मार्टफोन्स कनेक्ट सकती , एंड्रायड आइफोन दोनों स्मार्टफोन कम्पेटिबल ।","The device can connect Bluetooth smartphones, both Android iPhone compatible.",neutral
"टेबलेट डिस्प्ले अन्दर अच्छा काम , देखने एंगल काफी ज्यादा ।","Good work inside the tablet display, watching the angle too much.",positive
बैंडविथ कॉस्ट कम शायद उसका कारण ।,Bandwith cost less probably the reason for that.,negative
आईसीएस ics सेटिंग्स settings बदलाव आसान बनाता ।,ICS ICS Settings Settings makes easier.,positive
हालाकि स्‍क्रीन खूबी दी गई जिसमें साधारण स्‍मार्टफोन स्‍क्रीन दी गई दूसरी तरफ इंकजेट स्‍क्रीन दी गई ईबुक रीडर आपको मिलती ।,"However, the screen was given in which you would get an eBook reader given on the other side of the simple smartphone screen.",neutral
उत्तर प्रदेश ऐतिहासिक शहर देखने देश विदेश पर्यटक आते ।,Foreign tourists came to see Uttar Pradesh historic city.,positive
अन्य दिक्कते ।,Other problems.,negative
लगभग पूरे साल वर्षा वजह जगह हम बादलों निवास स्थान ।,Almost all year rain causes we cloud residence.,neutral
बाकी टू इन वन विपरीत माइक्रोमैक्स लैपटैब सॉलिड कीबोर्ड ।,The rest to two in one contrasting micromax laptab solid keyboard.,positive
"बार समझ आता खाना बनाने वाला बर्तन सही गर्म , अब बर्तन आपको बता देगा खाना बनाने गर्म होकर तैयार चुका ।","Bar understanding the cooking pot is right hot, now the utensils will tell you that cooking is hot and ready.",neutral
"कीमत , सी अच्छी विशेषताओं कारण लैपटॉप निश्चित रूप बढ़िया विकल्प साबित ।","Price, C good characteristics due to laptop proved to be sure of sure.",positive
"हालांकि औसत कैमरा , एप्प लांच समय धीमा परफार्मेंस , वास्तविक वॉल्यूम रॉकर जैसी खामियां , खाई इतनी गंभीर ।","Although flaws like average camera, app launch time slow performance, real volume rocker, the moat so serious.",negative
लेनोवो योगा 2 टैबलेट अच्छा सौदा साबित ।,Lenovo Yoga 2 Tablet proved good deal.,positive
"hp इलाइटबुक 1020 125 इंच फुल hd डिस्प्ले , टचस्क्रीन ।","HP Elitebook 1020 125 inch Full HD display, touchscreen.",neutral
फिसलर प्रेशर कूकर नई रेंज वीटाकंट्रोल डिजिटल नाम पेश खाना बनाने मैसेज जरिए संवाद स्थापित ।,Fisler pressure cooker new range of vitakentrol digital name introduced dialogue through the message of cooking.,neutral
छोटे छोटे दृश्यों समर्थ अभिनेताओं मौजूदगी कथ्य गाढ़ा करती ।,Small scenes with competent actors would have thickened the presence.,neutral
यहां लगभग 820 प्रजाति पौधे पाए जाते ।,About 820 species of plants were found here.,neutral
एकबार पूरी चार्ज बैटरी 18 दिन स्टैंडबाय टाइम देती ।,Once the entire charge battery would give 18 days standby time.,positive
"पुष्ट अनुभव कराता बार जी3 पीछे बटन उपयोग अभ्यस्त जाते , तरीके चाहेंगे ।","Getting a strong experience Bar G3 back button used to be used to using, ways would be wanted.",positive
"फिल्म आइटम सॉन्ग पटकथा चिप्पी , जिसका फिल्मांकन प्रभावशाली ।","Film item song screenplay chippy, whose filming impressive.",negative
फोन स्क्रीन 24 इंच स्क्रीन रिजोल्यूशन 320 गुणा 240 पिक्सल ।,Phone screen 24 inch screen resolution 320 x 240 pixels.,neutral
कीमत रेंज 156इंच लैपटॉप हम हर हाल फुल एचडी रेजोल्यूशन डिस्प्ले उम्मीद ।,Price range 156 inch laptop we hope every full HD resolution display.,negative
अब ऐतिहासिक विरासत हमलों झेल चुकी ।,Now historical heritage attacks have been faced.,neutral
"लैंडस्केप मोड पकड़ने स्पीकर्स तरफ लगे , स्पीकर दोनों किनारों लगे ।","Landscape mode holds the speakers on the side, the speaker is both sides.",neutral
बॉडी बात कंपनी प्लास्टिक उपयोग ज्यादा ।,Body talk company plastic use more.,neutral
आईपैड आईफोन खेले सकने गेम्स टीवी देखे खेले ।,Ipad played iPhone playing games watching TVs.,positive
"प्रभु देवा फिल्म वांटेड हिंदी फिल्मों कदम रखा , तभी टोक देना चाहिए ।","Prabhu Deva film Wanted Hindi films stepped up, only then should be interrupted.",neutral
"लिनोवो ए 1000 7 इंच स्‍क्रीन दी गई , 1024x600 पिक्‍सल सपोर्ट करती ।","Linovo A1000 7 inch screen was provided, 1024x600 would support pixel.",neutral
आसुस फोनपैड टेबलेट नजदीकी प्रतियोगी सैमसंग गैलेक्सी टैब 2 ।,Asus phonepad tablet nearby competitive Samsung Galaxy Tab 2.,neutral
नवदीप सिंह अनुष्का शर्मा एनएच 10 सेंसर कैंची चली ।,Navdeep Singh Anushka Sharma NH 10 sensor scissors ran.,neutral
फंक्शन बड़ी कमी ।,Functions huge shortage.,negative
शिवकर तलपड़े सहयोगी चरित्र थोड़े नाटकीय कृत्रिम लगते ।,Shivkar Talpade collaborative character looked slightly dramatic artificial.,neutral
वर्षा ऋतु समय जगह महत्व ज्यादा बढ़ जाता ।,The importance of rainy season would have increased more importance.,positive
किले पहुंचने खड़े घुमावदार मार्ग होकर जाना ।,Going to the fort to go through a winding route.,negative
"हालांकि , स्पेसिफिकेशन्स कागजों बेहतरीन लगती , चलिए जांचते असलियत प्रदर्शन कैसा ।","However, the specifications would seem excellent, let's examine how the reality performance.",neutral
इसलिए अगर चाहें 28 30 हजार रुपये बीच मौजूद विकल्पों तलाश लें क्योंकि अंत जाकर इतनी लागत आपको लैपटाप आएगी ।,"Therefore, if you want 28 30 thousand rupees, find the options present because you will get such a cost to the laptop.",neutral
"सामान्य बाहरी रोशनी न्यूनतम नॉइस अच्छे कलर रिप्रॉडक्शन अच्छी दिखनेवाली , संतुलित तस्वीरे लेता ।","Common external light minimum nois good color reproduction would take good, balanced pictures.",positive
डिवाइस स्‍पेशल फिटनेस फीचर्स ।,Device Special Fitness Features.,positive
स्क्रीन फिंगरटिप मैग्नेट काम व्यूइंग एंगल कहीं अच्छा माना ।,Screen fingertip magnet work viewing angle considered far good.,negative
नेक्सस 7 1280 x 800 पिक्सेल रेजोल्यूशन 7इंच बैकलिट आईपीएस डिस्प्ले पैनल ।,Nexus 7 1280 x 800 pixel resolution 7 inch backlit IPS display panel.,neutral
गेमलॉफ्ट प्रस्तुत जीटी रेसिंग 2 अन्य शानदार दिखने वाला गेम ।,GT racing presented GT Racing 2 other fantastic looking game.,positive
अल्ट्राबुक 10 प्वाइंट मल्टी टच विशेषता स्क्रीन 360 डिग्री आकार पूरी घूम जाती ।,Ultrabook 10 Point Multi Touch Characteristics Screen 360 degrees size rotates the whole.,positive
धनौल्टी सौंदर्य शांति संगम,Dhanaulti Beauty Shanti Sangam,positive
भारत 32 वल्र्ड हेरिटेज साइट्स 25 कल्चरल 7 नेचुरल साइट्स ।,India 32 World Heritage Sites 25 Cultural 7 Natural Sites.,neutral
गूगल ऐप्स अलावा यू यूरेका यूयूनिवर्स नाम ऐप प्रोवाइड ।,"In addition to Google apps, U Eureka Youunivel Name App Provide.",neutral
टेबल स्टैंड वॉल स्टैंड दोनों आती ।,Both table stand wall stands came.,neutral
शहरी दर्शकों आनंद अलग होगा ।,Urban audience Anand will be different.,positive
फिल्म नए मैक्सिको पृष्ठभूमि आधारित ।,The film new Mexico Background Based.,neutral
"थोडे हलके इस्तेमाल तहत जिसमें थोडी वेब ब्राउज़िंग गेमिंग शामिल , यूरेका पूरे दिन मेरा ।","Under a slight use that includes a small web browsing gaming, Eureka is mine all day.",neutral
"गैलेक्सी टैब 3 7इंच डिस्प्ले रेजोल्यूशन 1024 x 600 पिक्सेल , 170 पीपीआई पिक्सेल डेंसिटी देता ।","The Galaxy Tab 3 7 inch display resolution 1024 x 600 pixels, 170 PPI pixel density.",neutral
उन्होंने फिल्म पूरी मस्ती ।,He got the film complete fun.,neutral
नवीनतम आपरेटिंग सिस्टम एंड्रायड जैली बीन वी41 लगाया ।,Latest operating system Android Jelly Bean V41 installed.,neutral
"लूमिक्स जीएच4 कैमरे न्यू वीनस इंजन , माईर सप्रेशन , मैक्स आईएसओ25600 , 4के30पी2524पी , 1080 60पी50पी24पी , हाई ब्राइट , 10बिट आउटपुट , 30 वीएफआर एलसीडी फीचर्स दिए गए ।","Lumix GH4 camera New Venus Engine, Myr Spression, Max ISO 25600, 4K 30p 2524 P, 1080 60 P40P 24P, High Bright, 10 Bit Output, 30 VFR LCD features were given.",neutral
