original_text,translated_text,experience
केवलादेव राष्ट्रीय उद्यान केवलादेव घना राष्ट्रीय उद्यान राजस्थान स्थित प्रमुख राष्ट्रीय उद्यान ।,Keoladeo National Park Keoladeo Ghana National Park Rajasthan Major National Park at Rajasthan.,positive
गूगल नेक्सस 7 आपको एंड्रायड बेहतरीन अनुभव मिलता ।,Google Nexus 7 you would have got Android the best experience.,positive
विश्व धरोहर सूची शामिल स्थान प्रवासी पक्षियों बसेरा ।,Migratory birds settled in place included World Heritage List.,neutral
व्हाट्सप्प फीचर ।,Whatsapp feature.,positive
यहां सैलानियों काफी शांति मिलती ।,The tourists would have received a lot of peace here.,positive
लेखक निर्देशक तथ्यों साक्ष्यों गौर ।,Writer director facts evidence Gaur.,negative
"समय 3,999 रु ख़ास ऑफर डिजिफलीप प्रो et701 , प्रदर्शन विशेषताओं हिसाब मूल्य पैसा वसूल टेबलेट |","Time 3,999 Rs.",positive
पर्वतीय स्थल खंडाला नाम पर्यटक सूची ।,Mountainous site Khandala named Tourist List.,positive
24गीगाहर्ट्ज़ इंटेल कोर आई73630क्यूएम क्वाडकोर प्रोसेसर ।,24 GHz Intel Core i73630 QM Quadcore Processor.,neutral
"वैसे प्रोड्क्‍ट अच्‍छा , कंप्‍टीटर्स कड़ी टक्‍कर मिल सकती ।","By the way, the product good, the competition can get a tough collision.",positive
"गुड़गांव , हरियाणा एंबिएंस मॉल स्थित स्टेलर चिल्ड्रेन म्यूजियम इंटरैक्टिव , प्ले बेस्ड म्यूजियम ।","Gurgaon, Haryana Ambines Mall at Staller Children's Museum Interactive, Play Based Museum.",neutral
चौंकाने वाली कीमत आए कंप्यूटर नाम फीचर्स चौंकाने ।,Shocking price came to computer name features shocking.,positive
"दमदार एक्शन , सुपरहीरोज कलाकारी रोमांटिक ट्रेक ।","Strong action, superhero art romantic track.",positive
नतीजा फिल्म देखते आपको लगता बड़ा लॉजिकल गैप ।,"As a result, you would think a big logical gap while watching the film.",negative
अलावा सावन महाशिवरात्रि लाखों भक्त शिव जलाभिषेक ।,"Apart from Sawan Mahashivaratri, lakhs of devotees Shiva Jalabhishek.",positive
अलावा 12 गीगाहर्त्ज डयूलकोर प्रोसेसर 512 जीबी फ्लैश स्टोरेज वेरियंट उतारा ।,"Apart from the 12 GHz dualcore processor, 512 GB flash storage variant was launched.",neutral
"डिवाइस एप्स टास्क , फ्लैशलाइट ओमलेट एप्लीकेशन होगी जिसके जरिए दोस्तों बीच तस्वीरें शेयर सकेंगे ।","The device app will be task, flashlight omelet application through which friends will be able to share photos.",neutral
"स्मार्टफोन तुलना सैमसंग गियर 2 स्पो‌र्ट्स सारी विशेषताएं डाली डिवाइस व्हाट्स एप , एसएमएस , ट्विटर , फेसबुक अन्य चीजें इस्तेमाल ।","Smartphone Comparison Samsung Gear 2 Sports All Features Inserting All Features Using WhatsApp, SMS, Twitter, Facebook and other items.",neutral
हालांकि नेविगेशन यूज गेम खेलते बैटरी बड़ी तेजी खर्च ।,"However, battery spending very fast playing navigation use games.",neutral
शायद वर्षों दृश्य मेरे स्मृतिपटल अंकित ।,Perhaps the years of view my memory.,positive
शास्त्री रूप मिथुन चक्रवर्ती कृत्रिम बनावटी लगते ।,Mithun Chakravarti looks artificial artificial artificial article.,negative
तेजी गर्म ।,Fast hot.,negative
फोन बाॅडी पतली बैक पैनल शीशे बना ।,Phone body made thin back panel glass.,positive
फ्रंट फेसिंग स्पीकर्स वाइड एंगल्स सिसे 6 इंच स्क्रीन वीडियो देखना मनोरंजक ।,Front facing speakers wide angles are entertaining 6 inch screen videos.,positive
माइक्रोमैक्स फनबुक 7 इंच डिसप्ले 800x400 पिक्सल रिजॉल्यूशन ।,Micromax funbook 7 inch display 800x400 pixels resolution.,neutral
ओपेरा तालमेल समस्या ।,Opera coordination problem.,negative
मौका ऐसा आता देख डर लगता ।,"Seeing the opportunity, it is afraid to see this.",neutral
"दुखद , ब्लुटूथ कनेक्शन ।","Sad, Bluetooth connection.",negative
क्लोज अप मुकाबले चौड़े फ्रैम्स बेहतर ।,Close up matches wide frimbs better.,positive
ग्लॉसी बॉडी कारण फोन फिंगरप्रिंट ज्यादा दिखते ।,Glossy body causes phone fingerprints look more.,negative
माइक्रोमैक्स टेलीविजन मॉडल 50b5000fhd led स्पोर्ट्स नाम ।,Micromax television model 50b5000fhd LED Sports Name.,neutral
"फीचर्स खूबसूरत बनावट डिज़ाइन , शानदार डिस्प्ले , बेहतरीन परफॉरमेंस अच्छा कैमरा ।","Features Beautiful textured designs, fantastic displays, best performance good camera.",positive
"दोनों लैपटॉप फैमिली अलग वर्ज़न चिप इस्तेमाल , जेड580 1जीबी चिप वहीँ डीवी6 ज्यादा शक्तिशाली 2जीबी चिप लगा ।","Both laptop family different version chip uses, Z580 1 GB Chip is the same DV6 more powerful 2 GB chip.",neutral
"फास्‍ट स्‍मूद प्रोसेसिंग लावा ई टैब 1 गीगाहर्ट सिंगल कोर क्‍वॉलकॉम स्‍नैपड्रैगन प्रोसेसर , एंड्रायड 40 आईसीएस ओएस , 512 एमबी रैम , 4जीबी इंटरनल मैमोरी अलावा 2 मेगापिक्‍सन रियर वीडियो कॉलिंग फ्रंट वीजिए कैमरा इनबिल्‍ड ।","Fast Smud Processing Lava e -Tab 1 GHz Single Core Quolcomm Snapdragon Processor, Android 40 ICS OS, 512 MB RAM, 4GB internal memory, in addition to 2 megapickson rear video calling front we Camera Inbuilt.",neutral
सन् 1984 भोपाल गैस ट्रैजेडी फिल्म 20वीं सदी जानलेवा हादसे वजहों प्रभाव समेट पाती ।,The 1984 Bhopal gas tragedy film would have found impact due to the 20th century deadly accident.,neutral
चाहे ambilight हिसाब कस्टमाइज ।,Whether ambilight account customize.,neutral
टैबलेट अगले हिस्स 13 मेगापिक्सल कैमरा ।,Tablet next part 13 megapixel camera.,neutral
"हालाँकि टचपैड सामान्य नोटबुक्स बड़ा , लैपटॉप आकार हिसाब काफी बड़ा ।","Although touchpad normal notebooks big, laptop size account is quite large.",neutral
"वजन परिवहन सुविधाजनक , लगभग तीन पाउंड पहुँचता ।","Weight transport convenient, reaching about three pounds.",negative
"बेहतर प्रोसेसिंग स्पीड 13 गीगाहत्र्ज क्वॉडकोर प्रोसेसर , 2जीबी रैम , 8जीबी इंटरनल मेमोरी दी गई ।","Better processing speed 13 GHz quadcore processor, 2 GB RAM, 8 GB internal memory was given.",neutral
डिवाइस आईपैड 2 छोटे स्वरूप लगता ।,The device iPad 2 looks small.,neutral
इंटेक बे ट्रेल प्रोसेसर लैस होगा ।,INTEC Bay Trail processor will be equipped.,neutral
बैटरी बात हमने विडियो लूप टेस्ट डाला 7 घंटे 26 मिनट चला ।,Battery talk we put video loop test 7 hours 26 minutes.,neutral
एचपी स्लेटबुक एक्स2 101इंच डिस्प्ले सामने फिजिकल बटन ।,HP Slatebook X2 101 inch display front physical button.,neutral
इन कंप्यूटर्स पर्सनल बिजनेस दोनों काम उपयोग लिया ।,These computers used both personal business.,positive
अगर एंड्राइड फोंस तुलना परफॉरमेंस उतनी अच्छी ।,If the Android phones comparison performance as good.,negative
फिल्म एडिंटिंग कसी सकती ।,Film can tighten adding.,neutral
कभी यूजर सर्च बार खास नम्बर कोड पंच उसकी स्थिति जान ।,Sometimes user search bar special number code punch knows its position.,neutral
"हमारे देश कनेक्टिविटी आज बड़ी समस्या , वहां डिवाइस कम चलते ।","Our country connectivity today is a big problem, there is less device.",neutral
चाइनीज कंपनी जियाओमी यूएसपी उसका प्राइस टैग रहता ।,Chinese company Xiaomi USP would have its price tag.,positive
twitter periscope app एंड्रॉयड 444 किटकैट उससे ऊपर वर्जन काम ।,Twitter Periscope App Android 444 KitKat Work above that.,neutral
"कवर परंपरागत ब्रश्ड मेटल फिनिश , हमने काफी अधिक कीमत आसुस अल्ट्राबुक्स देखा ।","The cover traditional brushed metal finish, we saw much higher price asus ultrabooks.",neutral
"मिलाकर टैबलेट परफार्मेंस संतोष जनक , हालांकि कभी कभी एप्प क्रैश गए तथा कभी कभी टैबलेट धीमा ।","Together the tablet performance Santosh Janak, although sometimes app crashed and sometimes slowed the tablet.",neutral
"आईवॉच मदद मेल , एसएमएस भेजे ।","Iwatch help, send SMS.",neutral
स्मार्टफ़ोन प्राइस टैग आसानी फिट ।,Smartphone price tag easily fit.,positive
"एपल आईपैड कीमत $ 329 , अमेज़न गूगल किंडल फायर एचडी नेक्सस 7 टेबलेट $ 199 कीमत काफी ज्यादा ।","Apple iPad Price $ 329, Amazon Google Kindle Fire HD Nexus 7 Tablet $ 199 price is quite high.",negative
"सोनी एक्सपीरिया टेबलेट जेड ऐसा डिवाइस , हमें देखते पसंद आया ।","Sony Xperia Tablet jade such device, we liked watching.",positive
बैद्यनाथ मंदिर स्थापित लिंग भगवान शिव बारह च्योतिर्लिगों ।,Baidyanath Temple Established Linga Lord Shiva twelve chhyotirlingas.,neutral
यहां गुल पनाग प्रभाव बच पाई ।,Here the Gul Panag effect survived.,neutral
"रीयल रेसिंग 3 , डेड ट्रिगर , एंग्री बर्ड्स गेम्स अच्छी चलते ।","Real Racing 3, Dead Trigger, Angry Birds Games go well.",positive
42 इंच स्क्रीन साइज टीवी कीमत 39990 रुपए 49 इंच टीवी कीमत 49990 रुपए रखी गई ।,The 42 -inch screen size TV price was 39990 rupees 49 inch TV price was kept at 49990 rupees.,neutral
गुणवत्तापूर्ण ढंग निर्मित उपयोग आसान ।,Easy to use quality ways.,positive
उसकी स्पष्टता डिटेल ऐसी लीग थोड़ा अपडेट वक्त तुलना थोड़े बड़े गन्स लाने जरूरत ।,His clarity detail needs to bring such a league slightly updated time comparison.,positive
"घुमावदार पहाड़ियां , लुभावने दृश्य शांत वातावरण कारण पटनीटॉप पिकनिक आदर्श स्थान ।","Curved hills, breathtaking views calm atmosphere causing Patnitop Picnic Place.",positive
तीसरा वो आगे दशक लगता ।,"Thirdly, it would have taken a further decade.",neutral
"दिव्येंदु शर्मा कॉमिक अवतार लोगों अब देखा , यहां विद्रोही रूप असर छोड़ता ।","Divyendu Sharma comic avatar people now saw, leaving a rebellious form here.",neutral
घड़ी काले भूरे रंग लैदर पट्टे आपको काफी लुभाएगी ।,The clock black brown leather lease will enverse you.,positive
लगातार इम्प्रूव रही ।,Constant improvement.,positive
"हलांकि निर्धारित थोड़ा वक्त लगेगा क्या बात उपयोगिता खास अंतर पैदा , ।","However, it will take some time to create a special difference.",neutral
"वॉच प्रोसेसर बात , 12ghz क्‍वॉड कोर qualcomm snapdragon 400 soc प्रोसेसर लगा ।","Watch processor talk, 12GHz Quod Core Qualcomm Snapdragon 400 SoC processor.",neutral
वैसे बता दें उठाते समय वजन महसूस करेंगे इसलिए हाथ पकड़ने शुरू थोड़ा ध्यान देने जरूरत होगी ।,"By the way, you will feel weight while lifting, so there will be a need to pay a little attention.",neutral
इंटरनल स्टोरेज 4जीबी माइक्रो एसडी कार्ड 32 जीबी ।,Internal Storage 4 GB Micro SD Card 32 GB.,neutral
"टैबलेट बाई तरफ 35 मिमी जैक , एचडीएमआई hdmi , मिनी यूएसवी , माइक्रो एसडी तथा चार्जिंग साकेट पोर्टस लगे ।","Tablet by 35 mm jack, HDMI HDMI, Mini USV, Micro SD and Charging Sacket Portus.",neutral
गुड लुक्स ।,Good looks.,positive
यहां छोटे छोटे गांव आपको अलग एहसास कराते ।,Here small villages would make you feel different.,positive
बेंचमार्क टेस्ट नेक्सस 5 पीछे छोड़ देता बड़े स्वरुप एक्सपीरिया ज़ेड वन बेहतर रहता ।,The benchmark test Nexus 5 behind the big form Xperia Z One would have been better.,positive
सत्यवती छोटी भूमिका दिव्या मेनन जंचती ।,Satyavati little role Divya Menon Junch.,positive
"वाटर रस्सिटेंस आईपी 55 पानी झेल , पानी डूबो ।","Water ropes IP55 water, water drown.",neutral
", संसद पर्यावरण संबंधी स्थायी समिति निरीक्षण पीले पडऩे मुहर लगा दी ।",", Parliamentary Standing Committee inspection on the environment environment, approved yellow.",negative
कान्हा एशिया सुरम्य खूबसूरत वन्यजीव रिजर्वो ।,Kanha Asia Supener Beautiful Wildlife Reserve.,positive
फुल डेस्कटॉप रन ।,Full desktop run.,neutral
मंदिर आंतरिक साज सज्जा शिल्पकारी अलावा विशाल गुंबदों भव्य स्वरूप प्रदान ।,Temple internal decoration craftsmanship and giant domes provide a grand form.,positive
मेहनत घटिया फिल्म खो जाती ।,Hard work used to lose a poor film.,negative
"ऐसा लगता पहली बार निर्देशन कदम रख अमित खन्ना फिल्म उपन्यास दर्शकों भौंचक्का रखने काफी जोर , सुरुचिपूर्ण ।","It seems that for the first time, Amit Khanna, who moves to the film novel audience, is very loud, elegant.",negative
"सिर्फ जेड580 आगे रहता , बल्कि सारे ग्राफ़िक्स बेंचमार्क टेस्ट प्रतिद्वंदियों काफी पीछे छोड़ देता ।","Only Z580 would have been ahead, but all graphics benchmark test rivals would have left far behind.",positive
"हैदर 1995 कश्मीर पृष्ठभूमि , फिल्म साल राजनीतिक घटनाओं रेफरेंस ।","Hyder 1995 Kashmir Background, Film Year Political events reference.",neutral
टीवी पावर बचाने डिजाइन ।,TV power saving design.,positive
पिक्चर विडियो थोड़े सुस्त गैर दिलचस्प दिखते ।,Picture videos look slightly non -interesting.,negative
"100 फीसदी चार्ज हमनें घंटे फिल्म देखी , 30 मिनट गेम खेला 30 मिनट ब्लुटूथ हेंडसेट गाने सुने ।","100 percent charge we saw the film for hours, played 30 minutes of games, 30 minutes of Blutoth handset songs.",neutral
"कॉलर स्थिति सूचना कभी अत्यावश्यक कॉल जिसकी अपेक्षा , कभी मिस ।",Caller status information is sometimes urgent calls that sometimes miss.,neutral
कम्पाइटेबिलिटी आर्इफोन आर्इओएस6 आर्इओएस7।,Competuity IOS 6AOS 7.,neutral
इसलिए मतलब सही मायनों लाइव सूचना सुविधा देती ।,"Therefore, the meaning is the true sense live information facility.",negative
"टचस्क्रीन अतिरिक्त लाभ , नोटबुक टचस्क्रीन इस्तेमाल कम ज़रूरत पड़ती ।","Touchscreen additional benefits, notebook touchscreen use less required.",positive
अलावा कार्बन पुश मेल क्‍लाइंट तथा कार्बन मेसेंजर क्लाइंट karbonn push mail client and karbonn messenger client डाउनलोड साल मुफ्त ।,Apart from carbon push mail client and carbon messenger client Karbonn Push Mail Client and Karbonn Messenger Client download year free.,neutral
"नेक्सस 7 4325 एमएएच बैटरी , लगातार इस्तेमाल 78 घंटे आराम चल जाती ।","Nexus 7 4325 mAh battery, continuously used 78 hours of rest.",positive
"लॅग दिखाता , लोड ज्यादा समय लेता , खासकर गेम खेल चुके डिवाईस गरम ।","Log shows, load would take more time, especially the device who played games is hot.",negative
1 जीबी रैम क्षमता लूमिया 730 परफॉर्मेंस बढिया ।,1 GB RAM capacity Lumia 730 Performance Great.,positive
कॉन्टेक्ट स्टोरेज चुनें गूगल डिवाइस होगी एप्पलीकेशन सेटअप हिस्सा जाता ।,Select Contact Storage Google device will be the application setup.,neutral
भव्य मंदिर हम भगवान शिव बारहवें ज्योतिर्लिग नाम जानते ।,The grand temple we know the name Lord Shiva.,positive
टेबलेट पीछे हिस्सा एचपी लोगो सफ़ेद फिनिश ।,Tablet back part HP logo white finish.,neutral
आमतौर फूलों घाटी जून लेकर सिंतबर खुलती ।,"Usually, the flower of flowers would open on September by taking June.",neutral
विकी सदाना कास्टिंग उल्लेखनीय ।,Vicky Sadana Casting notable.,positive
फिल्म देखते लगता गानों म्यूजिक वीडियो लचर कथा जोड़ा ।,"Watching the film, the song music video was added to the story.",neutral
कंप्यूटर 40 डॉलर खर्च करके हैंडहेल्ड कंप्यूटर सिस्टम बदला ।,Computer changed the handheld computer system by spending $ 40.,neutral
कान्हा वादियों नैसर्गिक सौंदर्य दीदार आए विदेशी पर्यटक बैहर बैगाओं संस्कृृति परंपरगत खेलों नजदीक देख सकेंगे ।,Kanha litigants will be able to see the natural beauty of foreign tourists Baihar Baigas Sanskriti Sanskriti Sanskrit Sports.,positive
ऐसा इसलिए क्‍योंकि घड़ी बॉडी शेप देखने काफी मर्दाना सा ।,This is because watching the clock body shape is quite masculine.,neutral
"रिहाना , जेनिफर लोपेज , स्टीव मार्टिन जिम पार्सन सेलेब्स आवाज दी ।","Rihanna, Jennifer Lopez, Steve Martin Jim Parson Celebs Voices.",neutral
आकार हिसाब मोटा भारी ।,Size is thick heavy.,negative
"नए आईपैड 4 12 मेगापिक्सेल फ्रंट फेसिंग कैमरा , 720पी वीडियो रिकॉर्ड ।","New iPad 4 12 megapixel front facing camera, 720p video record.",neutral
फोन कैमरा आपको निराश नही करेगा ।,The phone camera will not disappoint you.,neutral
जगह जहां महात्मा बुद्ध ज्ञान प्राप्त ।,Place where Mahatma Buddha attains knowledge.,positive
"मामलों नेक्सस 7 बेहतर परफॉर्म मामलों गैलेक्सी नोट 510 बेहतर परफॉरमेंस देता , मिलाकर परफॉरमेंस मध्यम स्तर ।","Cases Nexus 7 Better Perform Cases Galaxy Note 510 gives better performance, including performance medium levels.",neutral
धीमी गति ऑटो फोकस ।,Slow speed auto focus.,negative
"ओएलईडी स्क्रीन , एंड्रायड वीयर , वाटर रस्सिटेंस आईपी 67 30 मिनट मीटर गहरे पानी रखा ।","OLED screens, Android Wear, Water Ruse IP 67 kept 30 minutes meter deep water.",neutral
सुपरफोन दर्जा क्योंकि फीचर्स अन्य फोन मसलन फोन स्क्रीन आपकी आंखों पुलतियों हरकत पढ़कर सहूलिसत हिसाब काम करेगी ।,Superphone status because features like other phones like phone screen will work conveniently by reading your eyes.,neutral
